{
  "schemaVersion": "runtime-capability-profile.v1",
  "id": "car-basic",
  "displayName": "Basic Car Controls",
  "surface": "car_basic",
  "connectivity": "tethered",
  "mediaOwnership": "remote_control_only",
  "capabilities": {
    "playback": [],
    "timeline": [],
    "interjection": [],
    "ai": [],
    "sync": [],
    "remoteControl": ["display_snapshot", "send_transport_commands"]
  },
  "forbiddenCapabilities": ["send_chapter_jump", "send_interjection_commands", "send_ai_commands", "record_audio"],
  "notes": ["Transport-only. Any interjection behavior requires a preconfigured safe command strategy outside this baseline profile."]
}
