{
  "schemaVersion": "runtime-capability-profile.v1",
  "id": "lock-screen-widget",
  "displayName": "Lock Screen / Widget",
  "surface": "lock_screen_widget",
  "connectivity": "tethered",
  "mediaOwnership": "remote_control_only",
  "capabilities": {
    "playback": [],
    "timeline": ["media_time", "chapter_timing", "playback_rate_observation"],
    "interjection": ["delegate_interjection_to_canonical_runtime"],
    "ai": [],
    "sync": [],
    "remoteControl": ["display_snapshot", "send_transport_commands", "send_chapter_jump", "send_interjection_commands"]
  },
  "forbiddenCapabilities": ["record_audio", "realtime_tts", "prerendered_audio", "native_media", "generate_listening_map", "summarize_interjections", "continue_discussion"],
  "notes": ["Compact command surface. The phone/tablet runtime performs all work."]
}
