{
  "schemaVersion": "runtime-capability-profile.v1",
  "id": "watch-untethered",
  "displayName": "Watch Untethered",
  "surface": "watch",
  "connectivity": "untethered",
  "mediaOwnership": "prepared_local_runtime",
  "capabilities": {
    "playback": ["prerendered_audio", "native_media"],
    "timeline": ["transcript_segments", "media_time", "chapter_timing", "playback_rate_observation"],
    "interjection": ["record_audio", "capture_transcript_anchor", "capture_media_anchor", "queue_offline_interjections"],
    "ai": [],
    "sync": ["queue_offline_events", "receive_prepared_packages"],
    "remoteControl": ["display_snapshot", "send_transport_commands", "send_chapter_jump", "send_interjection_commands"]
  },
  "forbiddenCapabilities": ["realtime_tts", "browser_owned_media", "remote_stream", "assistant_turn_tts", "summary_turn_tts", "generate_listening_map", "summarize_interjections", "cleanup_transcript", "continue_discussion", "provider_diagnostics"],
  "notes": ["No TTS generation, STT, AI, map generation, or provider calls while untethered."]
}
